root@lamp-s-1vcpu-1gb-tor1-01:~# tcpdump -r 0001.pcap
reading from file 0001.pcap, link-type EN10MB (Ethernet)
16:23:49.641294 IP lamp-s-1vcpu-1gb-tor1-01.ssh > 198.96.85.104.56449: Flags [P.], seq 1419144314:1419144378, ack 1851545036, win 513, length 64
16:23:49.641463 IP lamp-s-1vcpu-1gb-tor1-01.ssh > 198.96.85.104.56449: Flags [P.], seq 64:192, ack 1, win 513, length 128
16:23:49.641619 IP lamp-s-1vcpu-1gb-tor1-01.ssh > 198.96.85.104.56449: Flags [P.], seq 192:256, ack 1, win 513, length 64
16:23:49.642221 IP 198.96.85.104.56449 > lamp-s-1vcpu-1gb-tor1-01.ssh: Flags [.], ack 192, win 8189, length 0
16:23:49.642310 IP 198.96.85.104.56449 > lamp-s-1vcpu-1gb-tor1-01.ssh: Flags [.], ack 256, win 8189, length 0
16:23:49.844593 IP 159.65.155.227.38284 > lamp-s-1vcpu-1gb-tor1-01.ssh: Flags [.], ack 4096682809, win 262, options [nop,nop,TS val 1678234766 ecr 301353381], length 0
16:23:49.844675 IP lamp-s-1vcpu-1gb-tor1-01 > 159.65.155.227: ICMP lamp-s-1vcpu-1gb-tor1-01 tcp port ssh unreachable, length 60
